ISBA,Isabella Bank Corporation Common stock,380,51.8,51.44,50.68,50.11,2.57,BULLISH,1.26
BLMN,"Bloomin' Brands, Inc. Common Stock",547,6.46,6.68,6.75,6.85,2.58,BEARISH,1.09
DVS,Dolly Varden Silver Corporation Common S,412,4.53,4.68,4.8,4.79,2.58,MIXED,0.75
OIA,Invesco Municipal Income Opportunities T,302,6.33,6.28,6.22,6.12,2.58,BULLISH,0.96
BGIN,Bgin Blockchain Limited Class A Ordinary,320,2.85,2.95,3.02,3.01,2.59,MIXED,0.26
VTN,Invesco Trust for Investment Grade New Y,235,12.07,11.86,11.7,11.54,2.59,BULLISH,1.08
ARVN,"Arvinas, Inc. Common Stock",772,11.96,12.78,12.82,12.51,2.61,MIXED,0.94
HBCP,"Home Bancorp, Inc. Common Stock",483,61.67,61.28,60.74,59.67,2.61,BULLISH,1.19
NREF,"NexPoint Real Estate Finance, Inc. Commo",266,15.01,14.87,14.74,14.47,2.61,BULLISH,0.86
HBNC,"Horizon Bancorp, Inc. Common Stock",921,18.01,18.09,17.9,17.61,2.64,BULLISH,0.62
BSVN,Bank7 Corp. Common stock,415,44.07,44.5,44.25,43.33,2.64,BULLISH,0.58
USNA,"USANA Health Sciences, Inc. Common Stock",387,21.27,21.21,21.18,20.65,2.64,BULLISH,0.82
RBB,RBB Bancorp Common Stock,380,22.3,21.94,21.62,21.35,2.65,BULLISH,0.86
LOCO,"El Pollo Loco Holdings, Inc. Common Stoc",315,10.52,10.59,10.65,10.87,2.65,BEARISH,0.78
OCGN,"Ocugen, Inc. Common Stock",479,1.45,1.43,1.47,1.46,2.66,MIXED,0.55
GCBC,"Greene County Bancorp, Inc. Common Stock",408,23.96,23.84,23.47,23.2,2.66,BULLISH,0.65
REFI,"Chicago Atlantic Real Estate Finance, In",251,11.93,12.03,12.18,12.35,2.7,BEARISH,1.2
ODV,Osisko Development Corp. Common Shares,973,3.81,3.77,3.71,3.67,2.71,BULLISH,0.83
NEWTP,"NewtekOne, Inc. Depositary Shares, Non-C",695,24.0,23.98,23.81,23.33,2.72,BULLISH,0.8
CLPT,"ClearPoint Neuro, Inc. Common Stock",399,14.11,13.58,13.78,13.97,2.72,BEARISH,0.69
HEPS,D-Market Electronic Services & Trading A,845,2.62,2.68,2.7,2.63,2.75,MIXED,0.68
MNTK,"Montauk Renewables, Inc. Common Stock",244,1.73,1.73,1.68,1.68,2.75,BULLISH,0.22
BRBI,BRBI BR Partners S.A. ADSs,691,13.8,14.56,14.53,14.18,2.77,BULLISH,0.42
FBLA,"FB Bancorp, Inc. Common Stock",266,13.42,13.45,13.26,13.08,2.79,BULLISH,0.95
KBDC,"Kayne Anderson BDC, Inc. Common Stock",962,14.09,14.13,14.24,14.52,2.82,BEARISH,1.04
GYRE,"Gyre Therapeutics, Inc. Common Stock",784,8.15,7.92,7.87,7.69,2.83,BULLISH,0.56
KFRC,"Kforce, Inc. Common Stock",533,29.65,32.42,33.26,32.52,2.84,MIXED,0.96
ESQ,"Esquire Financial Holdings, Inc. Common ",927,108.3,110.58,110.02,107.49,2.85,BULLISH,0.6
HYLN,Hyliion Holdings Corp. Class A Common St,361,2.06,2.06,2.06,2.0,2.85,MIXED,0.88
RWAY,Runway Growth Finance Corp. Common Stock,314,8.69,8.85,8.99,9.1,2.86,BEARISH,0.86
CRESY,Cresud S.A.C.I.F. y A. American Deposita,733,12.0,12.54,12.65,12.31,2.88,MIXED,0.81
LND,Brasilagro Brazilian Agric Real Estate C,391,3.82,3.88,3.88,3.77,2.88,MIXED,0.66
MBUU,"Malibu Boats, Inc. Class A Common Stock",582,31.2,31.53,31.8,30.9,2.89,MIXED,0.81
KALV,"KalVista Pharmaceuticals, Inc. Common St",773,15.33,15.21,15.31,15.66,2.9,BEARISH,0.75
ALT,"Altimmune, Inc. Common Stock",524,4.62,4.79,4.84,4.7,2.9,MIXED,0.49
ALTI,"AlTi Global, Inc. Class A Common Stock",636,4.34,4.43,4.47,4.56,2.92,BEARISH,0.61
AHH,"Armada Hoffler Properties, Inc. Common S",555,6.92,6.99,6.95,6.79,2.92,BULLISH,0.77
VOR,Vor Biopharma Inc. Common Stock,552,13.23,13.3,13.58,13.19,2.92,MIXED,0.7
BHFAN,"Brighthouse Financial, Inc. Depositary s",773,13.52,13.5,13.46,13.1,2.97,BULLISH,0.4
ACIC,American Coastal Insurance Corporation C,538,11.02,11.09,11.14,11.42,2.97,BEARISH,0.89
UVSP,Univest Financial Corporation Common Sto,999,35.06,34.71,34.22,33.66,2.98,BULLISH,0.69
LEGH,Legacy Housing Corporation Common Stock ,530,22.08,21.44,21.27,20.78,2.98,BULLISH,0.92
LCNB,LCNB Corporation Common Stock,246,17.53,17.42,17.25,16.9,2.98,BULLISH,0.6
WALD,Waldencast plc Class A Ordinary Share,228,1.79,1.8,1.78,1.84,2.98,MIXED,0.59
ORRF,"Orrstown Financial Services, Inc. Common",738,37.81,37.69,37.17,36.56,3.0,BULLISH,0.39
